{
  "id": "mission.prelim-loot",
  "name": "Preliminary Ops: Loot",
  "pack": "preliminary-ops",
  "critOp": "loot",
  "critOpRoll": 2,
  "turningPoints": 4,
  "equipmentLimit": 4,
  "killOp": {
    "gradeTable": {
      "5": [1, 2, 3, 4, 5],
      "6": [1, 2, 4, 5, 6],
      "7": [1, 3, 4, 6, 7],
      "8": [2, 3, 5, 6, 8],
      "9": [2, 4, 5, 7, 9],
      "10": [2, 4, 6, 8, 10],
      "11": [2, 4, 7, 9, 11],
      "12": [2, 5, 7, 10, 12],
      "13": [3, 5, 8, 10, 13],
      "14": [3, 6, 8, 11, 14]
    },
    "clamp": true
  },
  "actions": ["core.a.loot"],
  "scoring": [
    {
      "id": "kill-grade-up",
      "op": "kill",
      "window": "operative.incapacitated",
      "metric": "killGradeIncreased",
      "cmp": "event",
      "vp": 1,
      "maxPerBattle": 5,
      "text": "Score 1 VP each time your kill grade rises to a new, higher grade (grades 1 to 5)."
    },
    {
      "id": "kill-grade-lead",
      "op": "kill",
      "window": "battle.end",
      "metric": "killGrade",
      "cmp": "gtEnemy",
      "vp": 1,
      "maxPerBattle": 1,
      "text": "At the end of turning point 4, score 1 VP if your kill grade is higher than the enemy grade."
    },
    {
      "id": "loot-action",
      "op": "crit",
      "window": "firefight.actionEnded",
      "fromTurningPoint": 2,
      "metric": "lootPerformed",
      "cmp": "event",
      "vp": 1,
      "capGroup": "crit-per-tp",
      "maxPerTurningPoint": 2,
      "text": "Score 1 VP each time one of your operatives performs Loot, to a maximum of 2 VP per turning point."
    }
  ],
  "objectiveSetup": {
    "markerMm": 40,
    "steps": [
      { "by": "other", "constraints": { "onCentreline": true, "minFromNeutralEdges": 2 } },
      {
        "by": "initiative",
        "constraints": {
          "whollyWithinTerritory": true,
          "differentTerritoryFromPrevious": true,
          "withinCentrelineInches": 3,
          "minFromOtherMarkers": 5,
          "minFromNeutralEdges": 2
        }
      },
      {
        "by": "other",
        "constraints": {
          "whollyWithinTerritory": true,
          "differentTerritoryFromPrevious": true,
          "withinCentrelineInches": 3,
          "minFromOtherMarkers": 5,
          "minFromNeutralEdges": 2
        }
      }
    ]
  },
  "maps": [
    {
      "id": "prelim-1",
      "name": "Map 1: short-edge deployment",
      "mapRoll": { "min": 1, "max": 3 },
      "playerEdges": {
        "A": { "a": { "x": -15, "z": -11 }, "b": { "x": -15, "z": 11 } },
        "B": { "a": { "x": 15, "z": -11 }, "b": { "x": 15, "z": 11 } }
      },
      "dropZones": {
        "A": [{ "x": -15, "z": -11 }, { "x": -9, "z": -11 }, { "x": -9, "z": 11 }, { "x": -15, "z": 11 }],
        "B": [{ "x": 9, "z": -11 }, { "x": 15, "z": -11 }, { "x": 15, "z": 11 }, { "x": 9, "z": 11 }]
      },
      "territories": {
        "A": [{ "x": -15, "z": -11 }, { "x": 0, "z": -11 }, { "x": 0, "z": 11 }, { "x": -15, "z": 11 }],
        "B": [{ "x": 0, "z": -11 }, { "x": 15, "z": -11 }, { "x": 15, "z": 11 }, { "x": 0, "z": 11 }]
      },
      "centreline": { "a": { "x": 0, "z": -11 }, "b": { "x": 0, "z": 11 } },
      "neutralEdges": [
        { "a": { "x": -15, "z": -11 }, "b": { "x": 15, "z": -11 } },
        { "a": { "x": -15, "z": 11 }, "b": { "x": 15, "z": 11 } }
      ],
      "centrePoint": { "x": 0, "z": 0 }
    },
    {
      "id": "prelim-2",
      "name": "Map 2: long-edge deployment",
      "mapRoll": { "min": 4, "max": 6 },
      "playerEdges": {
        "A": { "a": { "x": -15, "z": -11 }, "b": { "x": 15, "z": -11 } },
        "B": { "a": { "x": -15, "z": 11 }, "b": { "x": 15, "z": 11 } }
      },
      "dropZones": {
        "A": [{ "x": -15, "z": -11 }, { "x": 15, "z": -11 }, { "x": 15, "z": -8 }, { "x": -15, "z": -8 }],
        "B": [{ "x": -15, "z": 8 }, { "x": 15, "z": 8 }, { "x": 15, "z": 11 }, { "x": -15, "z": 11 }]
      },
      "territories": {
        "A": [{ "x": -15, "z": -11 }, { "x": 15, "z": -11 }, { "x": 15, "z": 0 }, { "x": -15, "z": 0 }],
        "B": [{ "x": -15, "z": 0 }, { "x": 15, "z": 0 }, { "x": 15, "z": 11 }, { "x": -15, "z": 11 }]
      },
      "centreline": { "a": { "x": -15, "z": 0 }, "b": { "x": 15, "z": 0 } },
      "neutralEdges": [
        { "a": { "x": -15, "z": -11 }, "b": { "x": -15, "z": 11 } },
        { "a": { "x": 15, "z": -11 }, "b": { "x": 15, "z": 11 } }
      ],
      "centrePoint": { "x": 0, "z": 0 }
    }
  ],
  "text": "Loot objectives the active operative controls. A marker can be looted only once per turning point; each loot scores, up to 2 VP per turning point.",
  "source": "docs/spec/11-missions.md M-1 to M-4 and the resolved map section"
}
